record_type,name,alias,secret_name,secret_type,description,purpose,store_type,username,password,pam_safe,pam_account_name,iam_account,iam_username,iam_access_key_id,iam_secret_access_key,atlas_public_key,atlas_private_key,tags,provider_engine,platform,network_name,auth_database,read_write_endpoint,read_only_endpoint,region,secret_alias,secret_id,enable_certificate_validation,domain,domain_controller_name,domain_controller_netbios,domain_controller_use_ldaps,domain_controller_enable_certificate_validation,domain_controller_ldaps_certificate,services,configured_auth_method_type,provision_format,target_set_type,secret_details,is_disabled,pcloud_account_safe,pcloud_account_name,provisioner_username,provisioner_password,comment
db_secret,,db_admin_secret,Finance-Prod-Admin,cyberark_pam,Privileged account for production finance database,Provisioning and break-glass access,,,,Finance-Prod,FINANCE-RDS-ADMIN,,,,,,,env=prod;team=finance,,,,,,,,,,,,,,,,,,,,,,,,,,,CyberArk PAM secret used by the finance PostgreSQL workspace
db_secret,,mongo_support_secret,Mongo-Support-User,username_password,Support credentials for MongoDB maintenance,Runbook automation,,support.automation,ChangeMeStrong!,,,,,,,,,env=shared;rotation=30d,,,,,,,,,,,,,,,,,,,,,,,,,,,Username/password secret for MongoDB atlas workspace
vm_secret,,workstations_admin_secret,Workstations-Privileged,PCloudAccount,Strong account stored in Privilege Cloud for workstation access,Provisioner account,,,,,,,,,,,,,,,,,,,,,,,,,,,,,,,,,"{""owner"":""Workspace Platform""}",,Windows-Servers,CORP-WIN-ADMIN,,,Privilege Cloud secret referenced by VM target set
database,finance-rds.cluster.internal,,,,,,,,,,,,,,,,,env=prod;service=finance,postgres-aws-rds,aws,AWS-Prod-Network,postgres,finance-rds.cluster.internal,,us-east-1,db_admin_secret,,true,,,,,,,primary:5432:db_admin_secret,local_ephemeral_user,,,,,,,,,PostgreSQL RDS workspace that uses the PAM secret
database,mongodb.ops.internal,,,,,,,,,,,,,,,,,env=shared;owner=platform,mongo-atlas-managed,atlas,Atlas-Network,admin,,mongo-readonly.ops.internal,,mongo_support_secret,,true,corp.local,dc01.corp.local,DC01,yes,yes,corp-root-ca-cert,metrics:27017:mongo_support_secret,,,,,,,,,,MongoDB Atlas workspace that references the username/password secret
vm_target_set,corp.local,,,PCloudAccount,Domain-joined Windows servers managed by SIA,,,,,,,,,,,,,,,,,,,,,workstations_admin_secret,,true,,,,,,,,,{user}@corp.local,Domain,,,,,,,VM target set referencing the Privilege Cloud secret
